<!ELEMENT fichero (webside, ficha+)>
<!ELEMENT ficha (nombre, apellido, direccion*, DUI, nacionalidad?)>
<!ELEMENT nombre (#PCDATA)>
<!ATTLIST nombre sexo (masculino|femenino) #REQUIRED >
<!ATTLIST nombre edad  CDATA  #IMPLIED>
<!ELEMENT apellido (#PCDATA)>
<!ELEMENT direccion (#PCDATA)>
<!ELEMENT DUI (#PCDATA)>
<!ELEMENT nacionalidad (#PCDATA)>
<!ATTLIST nacionalidad idioma CDATA "ingles">
<!ELEMENT webside (a)>
<!ELEMENT a (#PCDATA)>
<!ATTLIST a  
  href CDATA #IMPLIED
  xmlns CDATA #IMPLIED 
  target (_blank|_self|marco) "_self">