<?xml version="1.0" encoding="UTF-8"?>
<?xml-stylesheet type="text/css" href="./ejercicio-ii-2a-dtd.css"?>

<!DOCTYPE fichero SYSTEM "2a.dtd">

<fichero>
<website>
    <a xmlns="http://www.w3.org/1999/xhtml" href="../../index.html">Regresar</a>
</website>
 <ficha>
  <nombre sexo="femenino" edad="17">Angelina</nombre>
  <apellido>Fernandez</apellido>
  <direccion>c/Ulises, 36</direccion>
  <DUI>12365875-0</DUI>
  <nacionalidad idioma="EspaÃ±ol">El Salvador</nacionalidad>
 </ficha>
</fichero>